{
  "schema_version": "result/v1",
  "slug": "rcpsp-psplib-j30",
  "title": "PSPLIB J30 scheduling benchmark",
  "domain": "Operational Planning",
  "status": "published",
  "published_at": "2026-05-12",
  "updated_at": "2026-08-22",
  "summary": "Across accepted checkpoints under one frozen PSPLIB J30 contract, Evölther reduced the lower-is-better scheduling score from 14.312 at baseline to 12.087, and Evölther 2.0 reduced it further to 10.108 while preserving feasibility on all 80 instances.",
  "problem_statement": "Find a deterministic activity-priority rule for serial schedule generation that reduces makespan gap against proven PSPLIB J30 optima while preserving precedence and renewable-resource feasibility.",
  "evaluation_contract": {
    "summary": "Candidates are scored on 80 frozen PSPLIB J30 single-mode RCPSP instances. Every evaluated instance has a proven optimal makespan, and schedules must satisfy precedence constraints, renewable-resource capacities, finite priority scores, and deterministic eligible-activity selection.",
    "artifact": "artifacts/evaluation_contract.md"
  },
  "metrics": {
    "schema_version": "rcpsp-metrics/v2",
    "seed": 14.312164873860446,
    "previous": 12.086633114086395,
    "best": 10.108499479347454,
    "improvement": 4.203665394512992,
    "improvement_pct": 29.371275635529553,
    "improvement_from_previous": 1.9781336347389402,
    "improvement_from_previous_pct": 16.366291721335696,
    "units": "score",
    "direction": "lower_is_better",
    "validation_status": "deterministic-replay-pass",
    "score": 10.108499479347454,
    "mean_gap_pct": 5.010334851983718,
    "p95_gap_pct": 14.566184649610676,
    "max_gap_pct": 17.105263157894736,
    "mean_makespan": 63.8,
    "optimal_hit_rate": 0.3375,
    "instances_evaluated": 80.0,
    "invalid_priority_count": 0.0,
    "feasibility_penalty": 0.0,
    "valid_rate": 1.0,
    "exact_optima": 27,
    "baseline_exact_optima": 23,
    "previous_exact_optima": 19,
    "comparison_to_baseline": {
      "improved": 35,
      "unchanged": 27,
      "worse": 18
    }
  },
  "artifacts": {
    "candidate_code": "artifacts/accepted_candidate.py",
    "baseline_diff": "artifacts/baseline-to-evolther-2.diff",
    "evolution_trace": "artifacts/evolution.json",
    "score_trace": "artifacts/score-trace.json",
    "metrics": "artifacts/metrics.json",
    "provenance": "artifacts/provenance.json",
    "replay": "artifacts/replay.json",
    "schedule_example": "artifacts/schedule-example.json",
    "portfolio_comparison": "artifacts/portfolio-comparison.json",
    "feature_ablation": "artifacts/ablation.json",
    "plots": [
      "assets/objective-curve.svg",
      "assets/benchmark-comparison.svg",
      "assets/resource-load.svg",
      "assets/instance-comparison.svg",
      "assets/portfolio-instance-deltas.svg",
      "assets/gap-readout.svg",
      "assets/tail-gap-ladder.svg",
      "assets/schedule-network.svg"
    ]
  },
  "website": {
    "order": 2,
    "card_label": "02 Operational Planning",
    "card_summary": "A deterministic scheduling policy reaches a 29.37% lower governed score while preserving feasibility across the frozen portfolio.",
    "card_visual": "rcpsp",
    "card_metrics": [
      {
        "label": "Mean gap to optimum",
        "value": "5.01%"
      },
      {
        "label": "Baseline score reduction",
        "value": "29.37%"
      }
    ],
    "detail_path": "results/rcpsp-psplib-j30/",
    "display_labels": {
      "seed": "Baseline score",
      "previous": "Evölther score",
      "best": "Evölther 2.0 score",
      "improvement": "Score reduction"
    },
    "figure_captions": {
      "assets/objective-curve.svg": "Accepted-checkpoint progression from baseline through Evölther and Evölther 2.0 under one unchanged objective.",
      "assets/benchmark-comparison.svg": "Baseline, Evölther, and Evölther 2.0 comparison across the frozen portfolio.",
      "assets/resource-load.svg": "Actual renewable-resource profiles for baseline and Evölther 2.0 on j3025_9; capacities remain unchanged.",
      "assets/instance-comparison.svg": "Task-level baseline-to-Evölther 2.0 schedule comparison for j3025_9, from makespan 112 to 92 against optimum 84.",
      "assets/portfolio-instance-deltas.svg": "All 80 instance outcomes against baseline: 35 improved, 27 unchanged, and 18 worse.",
      "assets/gap-readout.svg": "Evölther 2.0 aggregate and tail diagnostics on the frozen portfolio.",
      "assets/tail-gap-ladder.svg": "Largest remaining Evölther 2.0 gaps against proven optimum.",
      "assets/schedule-network.svg": "RCPSP precedence and serial schedule-generation primer.",
      "artifacts/schedule-example.json": "Deterministic before-and-after schedule and renewable-resource profiles for j3025_9."
    },
    "score_note": "The score is the frozen evaluation contract for this public PSPLIB J30 subset. It is not a runtime benchmark and it is not a claim over all RCPSP instances."
  }
}
