{
  "schema_version": "result/v1",
  "slug": "circle-packing-26-unit-square",
  "title": "Exact 26-circle unit-square packing",
  "domain": "Geometric Optimization",
  "status": "published",
  "published_at": "2026-08-23",
  "summary": "Evölther 2.0 leads the manifested public corpus under three separately verified tolerance contracts and supplies a rational interval proof of strict local optimality for the nearby 78-contact root.",
  "problem_statement": "Place 26 variable-radius circles inside the unit square and maximize their total radius, keeping the 1e-6, 1e-10, and zero-tolerance feasibility contracts separate.",
  "evaluation_contract": {
    "summary": "Finite-decimal certificates are parsed as exact rationals and evaluated independently at tolerance 1e-6, 1e-10, and zero. Each check covers 104 walls, 325 pairs, and 26 positive radii.",
    "artifact": "artifacts/evaluation_contract.md"
  },
  "metrics": {
    "seed": -2.6359830849174704,
    "best": -2.6359830849176076,
    "improvement": 1.3722356584366935e-13,
    "improvement_pct": 5.205783247579742e-12,
    "units": "score",
    "direction": "lower_is_better",
    "validation_status": "exact-rational-certified",
    "seed_sum_radii": 2.6359830849174704,
    "accepted_sum_radii": 2.6359830849176076,
    "exact_seed_sum_radii": "2.635983084917470548216",
    "exact_accepted_sum_radii": "2.6359830849176077831865694854434817303966767982744748577457711298607038493344723396767997365079",
    "exact_gain": "0.0000000000001372349705694854434817303966767982744748577457711298607038493344723396767997365079",
    "circle_count": 26,
    "constraint_checks_passed": 455,
    "contact_count": 78,
    "min_radius": 0.06918067635723448,
    "max_radius": 0.13701043012374758,
    "mean_radius": 0.10138396480452337,
    "min_boundary_margin_exact": "1.0000000000000015957e-75",
    "min_pair_squared_margin_exact": "6.462889117127747543948689364593329656152501312641715080908715265113483426245412515828719437575261918e-76",
    "tolerance_1e_6_sum_radii": "2.63599872089287514",
    "tolerance_1e_10_sum_radii": "2.63598308647338795",
    "manifested_corpus_rank_1e_6": 1,
    "manifested_corpus_rank_1e_10": 1,
    "manifested_corpus_rank_exact": 1,
    "local_optimum_status": "strict-local-maximum-certified",
    "real_contact_root_score_lower": "2.6359830849176077831865694854434817303966767982744",
    "real_contact_root_score_upper": "2.6359830849176077831865694854434817303966767982745",
    "public_corpus_snapshot": "2026-08-08",
    "prior_float_sum_radii": 2.6359830849768984,
    "prior_float_validity_margin": -3.786615465628529e-11,
    "prior_float_status": "historical-non-authoritative"
  },
  "artifacts": {
    "publication_manifest": "artifacts/publication-manifest.json",
    "verifier": "artifacts/verifier.py",
    "verification_entrypoint": "artifacts/verifier.py",
    "certificate": "artifacts/exact.csv",
    "verification_report": "artifacts/verification.json",
    "local_optimum_interval": "artifacts/local_optimum_interval.json",
    "local_optimum_certificate": "artifacts/local_optimum_certificate.json",
    "local_optimum_verifier": "artifacts/prove_local_optimum.py",
    "public_corpus_audit": "artifacts/public_corpus_audit.json",
    "tolerance_certificates": [
      "artifacts/tolerance_1e-6.csv",
      "artifacts/tolerance_1e-10.csv",
      "artifacts/exact.csv"
    ],
    "metrics": "artifacts/metrics.json",
    "provenance": "artifacts/provenance.json",
    "plots": [
      "assets/tolerance-certificates.svg",
      "assets/tolerance-rankings.svg",
      "assets/exact-packing-contact-graph.svg"
    ]
  },
  "website": {
    "order": 3,
    "card_label": "03 Geometric Optimization",
    "card_summary": "Three tolerance-aware corpus leaders plus an exact rational certificate of strict local optimality for one 78-contact configuration.",
    "card_visual": "circle-packing",
    "card_metrics": [
      {
        "label": "Certified sum radii",
        "value": "2.635983084917607783…"
      },
      {
        "label": "Verification",
        "value": "Exact rational"
      }
    ],
    "detail_path": "results/circle-packing-26-unit-square/",
    "display_labels": {
      "seed": "Exact seed score",
      "best": "Certified score",
      "improvement": "Exact refinement"
    },
    "figure_captions": {},
    "score_note": "The governed score is negative exact total radius. The publication leads with sum radii and exact feasibility; the previous floating reconstruction is historical context only."
  }
}
